{
  "$schema": "https://json-schema.org/draft/2020-12/schema",
  "$id": "https://t-understand.dev/schemas/release-qualification.schema.json",
  "$comment": "Contract version 1.0.0",
  "type": "object",
  "additionalProperties": false,
  "required": [
    "schema_id",
    "schema_version",
    "version",
    "status",
    "gates",
    "inventory",
    "limitations",
    "generated_at"
  ],
  "properties": {
    "schema_id": {
      "const": "https://t-understand.dev/schemas/release-qualification.schema.json"
    },
    "schema_version": {
      "const": "1.0.0"
    },
    "version": {
      "type": "string",
      "pattern": "^1\\.1\\.0$"
    },
    "status": {
      "enum": [
        "PASS",
        "FAIL"
      ]
    },
    "gates": {
      "type": "array",
      "minItems": 1,
      "items": {
        "type": "object",
        "additionalProperties": false,
        "required": [
          "id",
          "status",
          "evidence"
        ],
        "properties": {
          "id": {
            "type": "string",
            "minLength": 1
          },
          "status": {
            "enum": [
              "PASS",
              "FAIL"
            ]
          },
          "evidence": {
            "type": "array",
            "items": {
              "type": "string"
            }
          }
        }
      }
    },
    "inventory": {
      "type": "object",
      "additionalProperties": {
        "type": "integer",
        "minimum": 0
      }
    },
    "limitations": {
      "type": "array",
      "items": {
        "type": "string"
      }
    },
    "generated_at": {
      "type": "string",
      "format": "date-time"
    }
  }
}
